{"contract_version":"1.0.0","metric_name":"deadline","editor_id":"editor-42","ready_for_approval_at":"2026-09-01T11:00:00Z","requested_eta":"2026-09-01T11:30:00Z","result":"on_time","evidence":{"source":"monday","monday_board_id":"board-1","monday_item_id":"item-1","column_ids":["status","requested_eta"],"event_ids":["event-101"],"source_timestamps":["2026-09-01T11:00:00Z"],"source_values":{"ready_for_approval_at":"2026-09-01T11:00:00Z","requested_eta":"2026-09-01T11:30:00Z"},"rule_version":"deadline-v1","calculated_at":"2026-09-01T11:05:00Z"}}
